title	href	dek	author	publish_date	thumbnail	sponsor
Celebs Are Growing Out Their Beards While They're Stuck at Home. Should You?	https://www.esquire.com/style/grooming/a31990850/celebrity-social-distancing-beards-coronavirus/	A follicular investigation.	Garrett Munce	2020-03-31T17:32:00Z	https://hips.hearstapps.com/hmg-prod.s3.amazonaws.com/images/index-quarantinebeards-2-new-1585666886.png?crop=1xw:1xh;center,top&resize=480:*	
The Best Natural Sunscreens to Keep Your Face Looking Its Best	https://www.esquire.com/style/grooming/g26900415/best-natural-sunscreen-for-men/	Every option you need to keep your skin safe, whether you're sprawled on the beach or taking a socially distant walk.	Avidan Grossman	2020-03-30T16:09:00Z	https://hips.hearstapps.com/hmg-prod.s3.amazonaws.com/images/sunscreen-1-1585324275.jpg?crop=1.00xw:1.00xh;0,0&resize=480:*	
How to Cut Your Hair (or at Least Keep It Presentable) at Home	https://www.esquire.com/style/grooming/a31957881/how-to-cut-your-own-hair-men/	Social distancing and shop closures means going the DIY route.	Garrett Munce	2020-03-27T18:04:00Z	https://hips.hearstapps.com/hmg-prod.s3.amazonaws.com/images/indexself-1585329333.jpg?crop=1xw:1xh;center,top&resize=480:*	
How to Help Your Barber While the Shop Is Closed	https://www.esquire.com/style/grooming/a31956315/how-to-help-barber-shops-covid-19-coronavirus/	The folks we trust to keep our hair on-point aren't at work. Here's how to do right by them right now.	Garrett Munce	2020-03-27T17:11:00Z	https://hips.hearstapps.com/hmg-prod.s3.amazonaws.com/images/indexbarb-1585325086.jpg?crop=1xw:1xh;center,top&resize=480:*	
The Best Electric Shavers to Buy Right Now	https://www.esquire.com/style/grooming/advice/g2911/best-electric-shavers/	All the (ahem) buzz about the best options on the market.	Avidan Grossman	2020-03-05T16:12:00Z	https://hips.hearstapps.com/hmg-prod.s3.amazonaws.com/images/index-1-1583251657.jpg?crop=1.00xw:1.00xh;0,0&resize=480:*	
A Gray Beard Was the Grooming Power Move at the 2020 Oscars	https://www.esquire.com/style/grooming/a30852464/gray-beard-trend-oscars-academy-awards-2020/	Celebrities are embracing their age, and it looks great on them.	Garrett Munce	2020-02-10T15:02:00Z	https://hips.hearstapps.com/hmg-prod.s3.amazonaws.com/images/gettyimages-1205153479.jpg?crop=1.00xw:0.335xh;0,0.194xh&resize=480:*	
10 Moisturizers With SPF to Keep You Looking Younger, Longer	https://www.esquire.com/style/grooming/g20159657/best-moisturizer-with-spf-for-men/	Use these to protect your face from sun damage all year.	Lauren Kranc	2020-02-05T15:54:00Z	https://hips.hearstapps.com/hmg-prod.s3.amazonaws.com/images/index-1579818370.jpg?crop=1.00xw:1.00xh;0,0&resize=480:*	
In a Daring Move, the FTC Is Cracking Down on Potential Monopolies in...Razors?	https://www.esquire.com/style/grooming/a30753881/harrys-schick-edgewell-razors-acquisition-blocked-ftc/	The agency just blocked the $1.37 billion acquisition of Harry's by Schick's parent company, Edgewell.	Avidan Grossman	2020-02-04T16:07:00Z	https://hips.hearstapps.com/hmg-prod.s3.amazonaws.com/images/index-79-1580831698.jpg?crop=1xw:1xh;center,top&resize=480:*	
This Is My Wintertime Skincare Routine and It’s Saving My Ass (Well, Actually, My Face)	https://www.esquire.com/style/grooming/a30548459/winter-skincare-tips-for-combination-skin/	Here's how I get my combination skin through the dermis-damaging months.	Nico Amarca	2020-01-27T18:09:00Z	https://hips.hearstapps.com/hmg-prod.s3.amazonaws.com/images/index-1579900024.jpg?crop=1.00xw:1.00xh;0,0&resize=480:*	
The After-Shave Balm That Finally Fixed My Razor Burn	https://www.esquire.com/style/grooming/a30612253/loccitane-cade-after-shave-balm-review-endorsement/	After years spent avoiding a clean shave, I discovered L'Occitane's game-changing Cade moisturizer.	Matt Miller	2020-01-22T18:32:00Z	https://hips.hearstapps.com/hmg-prod.s3.amazonaws.com/images/index-1579712270.jpg?crop=1.00xw:0.747xh;0,0.162xh&resize=480:*	The Endorsement
2020 is the Year of the Menicure	https://www.esquire.com/style/grooming/a30612393/manicure-for-men-trend/	Do you even polish, bro?	Garrett Munce	2020-01-22T11:30:00Z	https://hips.hearstapps.com/hmg-prod.s3.amazonaws.com/images/index-1579641356.jpg?crop=1xw:1xh;center,top&resize=480:*	
13 Post-Shave Products That'll Make Your Face Feel (and Look) Better	https://www.esquire.com/style/grooming/advice/g2806/best-after-shave/	Avoid the burn, bumps, and everything else with the right aftershave.	Esquire Editors	2020-01-14T13:42:00Z	https://hips.hearstapps.com/hmg-prod.s3.amazonaws.com/images/index-76-1577741772.jpg?crop=1.00xw:1.00xh;0,0&resize=480:*	
Timothée Chalamet Can Have Little a Mustache, As a Treat	https://www.esquire.com/style/grooming/a30468268/timothee-chalamet-mustache-reactions/	Nobody's sure about Timmy's new wispy boi—except me.	Ben Boskovich	2020-01-10T14:34:00Z	https://hips.hearstapps.com/hmg-prod.s3.amazonaws.com/images/gettyimages-1198348354.jpg?crop=1.00xw:0.752xh;0,0.0962xh&resize=480:*	
Happy 2020 Golden Globes to Pierce Brosnan's Facial Hair and Pierce Brosnan's Facial Hair Only	https://www.esquire.com/style/grooming/a30405953/pierce-brosnan-golden-globes-2020/	"The artist formerly known as ""Bond"" now goes by ""Van Dyke."""	Ben Boskovich	2020-01-06T00:53:00Z	https://hips.hearstapps.com/hmg-prod.s3.amazonaws.com/images/77th-annual-golden-globe-awards-pictured-pierce-brosnan-news-photo-1578271341.jpg?crop=1.00xw:0.699xh;0,0.0427xh&resize=480:*	
Your In-Flight Skin-Care Manual	https://www.esquire.com/style/grooming/a30299753/flight-travel-skincare-grooming/	Arrive moisturized and refreshed.	Garrett Munce	2020-01-01T12:00:00Z	https://hips.hearstapps.com/hmg-prod.s3.amazonaws.com/images/mask1-1576875725.jpg?crop=1.00xw:0.710xh;0,0.122xh&resize=480:*	
The Best Straight Razors for an Old-School Shave	https://www.esquire.com/style/grooming/g30062293/best-straight-razor/	Shaving with a cutthroat razor isn't as scary as it sounds. No, really.	Jonathan Evans	2019-11-30T19:50:00Z	https://hips.hearstapps.com/hmg-prod.s3.amazonaws.com/images/index-69-1575140119.jpg?crop=1xw:1xh;center,top&resize=480:*	
Panasonic's Arc5 Shaver Might Just Convince You to Go Electric	https://www.esquire.com/style/grooming/a30028646/panasonics-arc5-shaver-review-endorsement/	Tired of the old-school razor? Here's your solution.	Scott Christian	2019-11-29T11:00:00Z	https://hips.hearstapps.com/hmg-prod.s3.amazonaws.com/images/index-1574883077.jpg?crop=0.750xw:0.564xh;0.139xw,0.212xh&resize=480:*	The Endorsement
The 16 Best Face Washes to Keep You Looking Fresh During the Holidays	https://www.esquire.com/style/grooming/g14450556/best-face-wash-for-men/	Use these cleansers to combat winter's assault on your moneymaker.	Lauren Kranc	2019-11-26T21:50:00Z	https://hips.hearstapps.com/hmg-prod.s3.amazonaws.com/images/facewash-1574792141.jpg?crop=1.00xw:1.00xh;0,0&resize=480:*	
The 13 Best (and Worst) Beard Styles for Every Man	https://www.esquire.com/style/grooming/advice/g142/mens-beard-styles/	A not-at-all-scientific rundown of your options.	Esquire Editors	2019-11-26T21:02:00Z	https://hips.hearstapps.com/hmg-prod.s3.amazonaws.com/images/indexx-7-1574802794.jpg?crop=1.00xw:1.00xh;0,0&resize=480:*	
6 Reasons You Absolutely Need an Electric Razor	https://www.esquire.com/style/grooming/a29642239/reasons-you-need-electric-razor-panasonic/	A more seamless and effortless shave awaits.	Ben Radding	2019-11-07T10:45:00Z	https://hips.hearstapps.com/hmg-prod.s3.amazonaws.com/images/es-lv97-k-lifestyle-img02-copy-1572529519.jpg?crop=1.00xw:0.752xh;0,0.127xh&resize=480:*	Panasonic
The 2019 Esquire Grooming Awards	https://www.esquire.com/style/grooming/a29669716/best-grooming-products-for-men-2019/	Everything you need to keep you looking (and feeling, and smelling) like the best you.	Esquire Editors	2019-11-05T11:00:00Z	https://hips.hearstapps.com/hmg-prod.s3.amazonaws.com/images/lead-5-1572648877.jpg?crop=1xw:1xh;center,top&resize=480:*	
Save $100 on This Top-Rated Electric Shaver Today	https://www.esquire.com/style/grooming/a29689628/walmart-braun-electric-shaver-series-7-sale/	Skipping Movember? Meet your clean-shave solution.	Kelsey Mulvey	2019-11-04T21:43:00Z	https://hips.hearstapps.com/hmg-prod.s3.amazonaws.com/images/braun-shaver-1572896875.jpg?crop=1xw:1xh;center,top&resize=480:*	
The 15 Best Beard Grooming Kits to Keep Your Facial Hair Looking Its Best	https://www.esquire.com/style/grooming/g29658367/best-beard-grooming-kits/	You could acquire them piecemeal, but why not get all the core components at once?	Brady Langmann and Lauren Kranc	2019-10-31T22:48:00Z	https://hips.hearstapps.com/hmg-prod.s3.amazonaws.com/images/index-1572560157.jpg?crop=1.00xw:1.00xh;0,0&resize=480:*	
Baby, Baby, Baby, No: A Retrospective on Justin Bieber's Hair	https://www.esquire.com/style/grooming/a29644387/justin-bieber-haircut-styles/	From a swoop to a messy spike, the journey to an adult haircut is a complex one.	Justin Kirkland	2019-10-31T14:45:00Z	https://hips.hearstapps.com/hmg-prod.s3.amazonaws.com/images/indexx-1-1572472009.jpg?crop=1xw:1xh;center,top&resize=480:*	
13 Indispensable Mustache Styles to Try This Movember	https://www.esquire.com/style/grooming/g2890/mustache-styles-for-men/	Go ahead and let it grow. Just make sure to take notes from one of these guys' spectacular 'staches.	Esquire Editors	2019-10-29T18:24:00Z	https://hips.hearstapps.com/hmg-prod.s3.amazonaws.com/images/indexx-3-1572371796.jpg?crop=1.00xw:1.00xh;0,0&resize=480:*	
The 10 Best Beard Balms for Taming Your Facial Fuzz	https://www.esquire.com/style/grooming/advice/g2807/best-beard-balm/	Bonus: They'll also make it smell nice.	Lauren Kranc	2019-10-28T20:45:00Z	https://hips.hearstapps.com/hmg-prod.s3.amazonaws.com/images/beardbalms-1572282254.jpg?crop=1.00xw:1.00xh;0,0&resize=480:*	
Movember Is Coming. Here's What You Need to Know.	https://www.esquire.com/style/grooming/advice/a30574/movember-mustache-guide-blind-barber/	Before you grow your mo (aka mustache), there's some essential info you should consider.	Justin Kirkland	2019-10-28T13:59:00Z	https://hips.hearstapps.com/hmg-prod.s3.amazonaws.com/images/gettyimages-98631341-1572269363.jpg?crop=1.00xw:0.352xh;0,0.0681xh&resize=480:*	
18 Ways to Keep Your Skincare Routine On Point This Winter	https://www.esquire.com/style/grooming/g13438671/cold-weather-skincare-grooming-men/	Here's how to beat the cold-weather blues.	Christine Flammia and Adam Schubak	2019-10-11T16:21:00Z	https://hips.hearstapps.com/hmg-prod.s3.amazonaws.com/images/index-56-1570807887.jpg?crop=1.00xw:1.00xh;0,0&resize=480:*	
The Best Mustache Wax for Keeping Your Facial Hair in Top Shape	https://www.esquire.com/style/grooming/g19094011/best-mustache-wax/	It's all in the routine.	The Esquire Editors	2019-10-08T23:44:00Z	https://hips.hearstapps.com/hmg-prod.s3.amazonaws.com/images/gettyimages-917637006-1-1520276927.jpg?crop=0.865xw:0.649xh;0.0433xw,0.0865xh&resize=480:*	
George Clooney's Mighty Beard Is Not Impossible to Achieve	https://www.esquire.com/style/grooming/a29230434/george-clooney-beard-how-to-grow/	The true power lies in the majesty of his mustache.	Ben Boskovich and Jonathan Evans	2019-09-25T18:16:00Z	https://hips.hearstapps.com/hmg-prod.s3.amazonaws.com/images/gettyimages-1176790780.jpg?crop=0.779xw:0.260xh;0.0769xw,0.0118xh&resize=480:*	
Adam Levine's New 'Corn Hawk' Begs the Question: You Okay, Adam Levine?	https://www.esquire.com/style/grooming/a29229168/adam-levine-cornrows-shaved-head-hairstyle-2019/	Dude, what the hell are you doing?	Jonathan Evans	2019-09-25T16:31:00Z	https://hips.hearstapps.com/hmg-prod.s3.amazonaws.com/images/backgrid-bgus-1729858-006-mod-1569427058.jpg?crop=1.00xw:0.753xh;0,0.110xh&resize=480:*	
Joe Keery Didn't Get a Bowl Cut. He Got a 'Rob Thomas'—and It Is Spectacular.	https://www.esquire.com/style/grooming/a29042447/stranger-things-joe-keery-new-short-haircut-not-a-bowl-cut/	"Or maybe it's an ""Oasis."" But it's not a bowl cut."	Jonathan Evans	2019-09-13T22:57:00Z	https://hips.hearstapps.com/hmg-prod.s3.amazonaws.com/images/shutterstock-editorial-10412682y-1568413483.jpg?crop=1.00xw:0.745xh;0,0.00758xh&resize=480:*	
The Aromatic Beard Oil That'll Change How You Look and Feel	https://www.esquire.com/style/grooming/a28581189/cremo-beard-oil-forest-blend/	It smells great, reduces itchiness, and is super easy to use.	Ben Radding	2019-09-01T22:00:00Z	https://hips.hearstapps.com/hmg-prod.s3.amazonaws.com/images/04-hdm-190725-esqxcremo-318-h-1567088822.jpg?crop=1.00xw:0.385xh;0,0.478xh&resize=480:*	Cremo
How to Make Everything—From Your Home to Your Body—Smell Great, All the Time	https://www.esquire.com/style/grooming/a28519621/esquire-guide-smelling-good/	Here's Esquire's essential guide to everything from cologne and candles to incense and fancy car fresheners.	Esquire Editors and Photographs by Don Penny, Illustrations by Kelsey Drake	2019-08-29T11:58:00Z	https://hips.hearstapps.com/hmg-prod.s3.amazonaws.com/images/indexx-1567016099.jpg?crop=0.00326xw:0.00651xh;0.282xw,0.990xh&resize=480:*	
The 12 Best Natural Deodorants That Actually Work	https://www.esquire.com/style/grooming/g26860168/best-natural-deodorant-for-men/	Stock up before the heat hits full blast.	Christine Flammia	2019-08-28T22:38:00Z	https://hips.hearstapps.com/hmg-prod.s3.amazonaws.com/images/deor-index-1567031996.jpg?crop=1.00xw:1.00xh;0,0&resize=480:*	
Timothée Chalamet's Bowl Cut in 'The King' Is the Start of a Revolution	https://www.esquire.com/style/grooming/a28832186/timothee-chalamet-the-king-netflix-trailer-bowl-cut/	I'm sorry to report that the bowl cut has been waging a comeback campaign for months. Long live the bowl cut.	Justin Kirkland	2019-08-27T17:53:00Z	https://hips.hearstapps.com/hmg-prod.s3.amazonaws.com/images/screen-shot-2019-08-27-at-12-18-26-pm-1-1566922856.png?crop=0.808xw:0.718xh;0.0625xw,0.142xh&resize=480:*	
Save Big on This Top-Rated Electric Razor Today at Walmart	https://www.esquire.com/style/grooming/a28820893/walmart-philips-norelco-razor-sale/	Act fast to upgrade your morning shave.	Kelsey Mulvey	2019-08-26T21:14:00Z	https://hips.hearstapps.com/hmg-prod.s3.amazonaws.com/images/s5660-84-u5p-global-001-1566841581.jpg?crop=1.00xw:0.805xh;0,0&resize=480:*	
I Am Entirely Too Invested in This Anonymous 'Jimmy Kimmel Live!' Security Guard's Mustache	https://www.esquire.com/style/grooming/g28802420/jimmy-kimmel-live-security-guard-mustache/	Maybe you should be, too.	Jonathan Evans	2019-08-26T10:00:00Z	https://hips.hearstapps.com/hmg-prod.s3.amazonaws.com/images/gettyimages-1048703214.jpg?crop=1.00xw:1.00xh;0,0&resize=480:*	
Getting David Beckham's Impeccable Haircut Is, Surprisingly, Pretty Easy	https://www.esquire.com/style/grooming/a28724837/david-beckham-haircuts/	The Living Hair God's latest 'do isn't difficult to pull off—even for mere mortals.	Jonathan Evans	2019-08-17T10:45:00Z	https://hips.hearstapps.com/hmg-prod.s3.amazonaws.com/images/david-beckham-attends-day-ten-of-the-wimbledon-tennis-news-photo-1161411992-1565993492.jpg?crop=1.00xw:0.396xh;0,0.0430xh&resize=480:*	
So, You Want to Get a Male Brazilian	https://www.esquire.com/style/grooming/a28659568/brazilian-wax-for-men-guide/	There's more to the procedure than a wax and a rip.	Justin Kirkland	2019-08-15T10:00:00Z	https://hips.hearstapps.com/hmg-prod.s3.amazonaws.com/images/jon-1565382636.jpg?crop=1xw:0.75xh;center,top&resize=480:*	
Sorry, Mayor Pete, but You're Wrong About This Soap Thing	https://www.esquire.com/style/grooming/a28691820/pete-buttigieg-dish-soap-same-thing-iowa-state-fair/	Soap and dish soap should not be used interchangeably.	Jonathan Evans	2019-08-13T22:34:00Z	https://hips.hearstapps.com/hmg-prod.s3.amazonaws.com/images/index-29-1565733752.jpg?crop=1xw:1xh;center,top&resize=480:*	
Manscaping Is a Terrible Word, but It’s Not Necessarily a Bad Idea	https://www.esquire.com/style/grooming/a28466874/manscaping-tips-guide/	Here’s what you need to know about body grooming.	Christine Flammia	2019-08-05T10:00:00Z	https://hips.hearstapps.com/hmg-prod.s3.amazonaws.com/images/index-2-1564602719.jpg?crop=1.00xw:0.997xh;0,0&resize=480:*	
Here's What You Need to Know Before You Shave Your Head	https://www.esquire.com/style/grooming/a28251959/shaved-head-haircut/	Turns out, not all bald heads are the same.	Christine Flammia	2019-07-08T15:42:00Z	https://hips.hearstapps.com/hmg-prod.s3.amazonaws.com/images/travolta-gettyimages-1145559743.jpg?crop=1xw:1xh;center,top&resize=480:*	
Choosing the Right Shampoo Will Change Your Whole Morning Routine	https://www.esquire.com/style/grooming/g19504376/best-shampoos-men/	These are 16 of our favorites.	Christine Flammia	2019-06-17T14:40:00Z	https://hips.hearstapps.com/hmg-prod.s3.amazonaws.com/images/shampoo-1560543305.jpg?crop=1.00xw:1.00xh;0,0&resize=480:*	
The 15 Best Summer Hairstyles to Try This Season	https://www.esquire.com/style/grooming/g27821842/summer-hairstyles-for-men-ideas/	From many takes on the fade to a full-on buzz, here's what to ask for.	Christine Flammia	2019-06-17T10:00:00Z	https://hips.hearstapps.com/hmg-prod.s3.amazonaws.com/images/gettyimages-1153702025.jpg?crop=1.00xw:1.00xh;0,0&resize=480:*	
The 17 Best Deodorants to Keep You Smelling Fresh	https://www.esquire.com/style/grooming/g1269/best-deodorant/	Sweating is fine. Stinking is not.	Esquire Editors	2019-06-14T15:13:00Z	https://hips.hearstapps.com/hmg-prod.s3.amazonaws.com/images/deo-1560518478.jpg?crop=1.00xw:1.00xh;0,0&resize=480:*	
Understanding the Ins and Outs of Body Contouring	https://www.esquire.com/style/grooming/a27728093/body-contouring-sculpting-liposuction-guide-advice/	Yes, you can melt fat with a laser. Here’s what that means in real life.	Garrett Munce	2019-06-07T11:00:00Z	https://hips.hearstapps.com/hmg-prod.s3.amazonaws.com/images/lede-1559864597.jpg?crop=1.00xw:0.502xh;0,0.498xh&resize=480:*	
Gillette's New Ad Features a Transgender Man's First Shave With His Father	https://www.esquire.com/style/grooming/a27610361/gillette-ad-transgender-man-shaving-samson-bonkeabantu-brown/	"""I'm at the point in my manhood where I'm actually happy."""	Jonathan Evans	2019-05-28T15:46:00Z	https://hips.hearstapps.com/hmg-prod.s3.amazonaws.com/images/index-first-shave-1559061601.jpg?crop=1.00xw:1.00xh;0,0&resize=480:*	
Apparently We Have Pitbull to Thank (Blame?) for John Travolta's Bald Head	https://www.esquire.com/style/grooming/a27573418/john-travolta-pitbull-bald-shaved-head/	The actor and the singer are friends, and Mr. Worldwide encouraged the move.	Jonathan Evans	2019-05-23T20:36:00Z	https://hips.hearstapps.com/hmg-prod.s3.amazonaws.com/images/pitbull-travolta-1558640773.jpg?crop=1xw:1xh;center,top&resize=480:*	
A Solid Skincare Routine Can Make a Huge Difference. So Why Haven’t You Adopted One Yet?	https://www.esquire.com/style/grooming/a27547425/best-mens-skincare-routine/	Here's a guide to saving your face (and defying age), no matter whether you're a beginner or an expert.	Garrett Munce	2019-05-22T14:41:00Z	https://hips.hearstapps.com/hmg-prod.s3.amazonaws.com/images/grooming-basics-5-1558473250.png?crop=1xw:1xh;center,top&resize=480:*	
Real Friends Manscape Together. (Apparently.)	https://www.esquire.com/style/grooming/a27528998/manscaping-statistics/	"A new study shows that a not-zero percentage of dudes enlist their buddies' help in grooming ""down there."""	Justin Kirkland	2019-05-21T10:30:00Z	https://hips.hearstapps.com/hmg-prod.s3.amazonaws.com/images/razor-blades-on-orange-background-royalty-free-image-1003893062-1558388823.jpg?crop=1xw:0.74929xh;center,top&resize=480:*	
Your Beard Needs Oil. Here’s What to Get.	https://www.esquire.com/style/grooming/a26189/beard-oil/	If you aren't using beard oil, consider this an official notice.	Esquire Editors	2019-05-20T13:43:00Z	https://hips.hearstapps.com/hmg-prod.s3.amazonaws.com/images/momoa-2-1558359567.jpg?crop=0.9990749306197965xw:1xh;center,top&resize=480:*	
I Figured Out Why I Hate Don Jr.'s Beard So Much	https://www.esquire.com/style/grooming/a27467164/donald-trump-jr-beard-neckline-problem/	It's all about drawing the right lines. He didn't.	Jonathan Evans	2019-05-14T16:51:00Z	https://hips.hearstapps.com/hmg-prod.s3.amazonaws.com/images/gettyimages-1138956184.jpg?crop=1.00xw:0.753xh;0,0.0944xh&resize=480:*	
Jonah Hill's Hair Is Proof That Sleaze Doesn't Die, It Simply Evolves	https://www.esquire.com/style/grooming/a27465859/jonah-hill-bleached-hair-sleaze/	The actor has toned down his fits recently, but his grown-out, half-bleached ’do is a statement in and of itself.	Jonathan Evans	2019-05-14T15:06:00Z	https://hips.hearstapps.com/hmg-prod.s3.amazonaws.com/images/jonah-hill-hair-1557842718.jpg?crop=1.00xw:0.482xh;0,0.0212xh&resize=480:*	
All the Haircuts on 'The Bachelorette' Contestants, Ranked	https://www.esquire.com/style/grooming/a27410493/the-bachelorette-contestants-haircuts-ranked/	Would a side fade with a swoopy top by any other name smell as sweet?	Justin Kirkland	2019-05-08T23:18:00Z	https://hips.hearstapps.com/hmg-prod.s3.amazonaws.com/images/bach-1557350456.jpg?crop=1xw:1xh;center,top&resize=480:*	
The Most Epic Mustache the Year You Were Born	https://www.esquire.com/style/grooming/g27410801/famous-mustache-year-you-were-born/	These looks are iconic.	Mario Abad	2019-05-08T21:10:00Z	https://hips.hearstapps.com/hmg-prod.s3.amazonaws.com/images/mh-moustaches-1557333699.jpg?crop=1.00xw:1.00xh;0,0&resize=480:*	
Here's What the 'Game of Thrones' Actors Look Like Without Beards	https://www.esquire.com/style/grooming/g27410460/game-of-thrones-actors-without-beards/	A song of ice and shaving burns, a clash of trimmers, a storm of razors. Meet the once-bearded men of Westeros.	The Editors	2019-05-08T20:49:00Z	https://hips.hearstapps.com/hmg-prod.s3.amazonaws.com/images/mh-got-beards-3-1556134913.png?crop=1.00xw:1.00xh;0,0&resize=480:*	
The 11 Best Beard Trimmers for Every Type of Facial Hair	https://www.esquire.com/style/grooming/advice/g2752/best-beard-trimmers/	Whether you're going for stubble or something longer, these will help you get there.	Esquire Editors	2019-05-06T13:15:00Z	https://hips.hearstapps.com/hmg-prod.s3.amazonaws.com/images/gettyimages-926808748-1532454645.jpg?crop=1xw:1xh;center,top&resize=480:*	
15 Short Haircuts That Will Never Go Out of Style	https://www.esquire.com/style/grooming/g1653/best-short-hairstyles/	As seen on Jake Gyllenhaal, David Beckham, Pharrell Williams, and more.	Esquire Editors	2019-05-03T14:50:00Z	https://hips.hearstapps.com/hmg-prod.s3.amazonaws.com/images/lead-short-summer-haircut-gettyimages-492416565-1556829330.jpg?crop=0.987xw:0.990xh;0,0&resize=480:*	
The Best Gift to Give Your Dad This Father’s Day Is Free. Seriously.	https://www.esquire.com/style/grooming/a27310083/brickell-mens-products-starter-kit-review/	Save your money and let him try out $65 worth of natural grooming goods.	Adam Mansuroglu	2019-04-29T19:56:00Z	https://hips.hearstapps.com/hmg-prod.s3.amazonaws.com/images/brickell-lead-1556502779.jpg?crop=1.00xw:1.00xh;0,0&resize=480:*	
The 10 Best Razors to Keep Your Face Stubble-Free	https://www.esquire.com/style/grooming/g27288330/best-razor-for-face/	From disposables to multi-blade options to high-end safety razors, we've got you covered.	Christine Flammia	2019-04-29T14:31:00Z	https://hips.hearstapps.com/hmg-prod.s3.amazonaws.com/images/razor-1556547247.png?crop=1.00xw:1.00xh;0,0&resize=480:*	
The 11 Best Products to Rid Your Skin of Pimples	https://www.esquire.com/style/grooming/g27227878/how-to-get-rid-of-pimples/	Whether you're acne-prone or just have a breakout, having these picks on hand will help calm 'em down.	Christine Flammia	2019-04-24T14:27:00Z	https://hips.hearstapps.com/hmg-prod.s3.amazonaws.com/images/pimple-final-1556115666.png?crop=1.00xw:1.00xh;0,0&resize=480:*	
The 11 Best Products to Get Your Feet in Shape for Sandal Season	https://www.esquire.com/style/grooming/g27208758/how-to-get-rid-of-calluses/	Let's start with those tough calluses.	Christine Flammia	2019-04-22T14:51:00Z	https://hips.hearstapps.com/hmg-prod.s3.amazonaws.com/images/callus-1555944364.png?crop=1.00xw:1.00xh;0,0&resize=480:*	
Justin Bieber, Savior of Sleaze, Just Got a Very Un-Sleazy Haircut	https://www.esquire.com/style/grooming/a27193989/justin-bieber-haircut-hailey-baldwin-instagram/	Hailey Bieber shared his new 'do on Instagram. Our boy is all cleaned up.	Ben Boskovich	2019-04-18T15:46:00Z	https://hips.hearstapps.com/hmg-prod.s3.amazonaws.com/images/gettyimages-1128837142.jpg?crop=1.00xw:0.334xh;0,0.0999xh&resize=480:*	
Jason Momoa Shaved Off His Beard to Raise Awareness About Plastic Waste	https://www.esquire.com/style/grooming/a27193489/jason-momoa-shaved-beard-plastic-waste-awareness/	"The ""Game of Thrones"" and ""Aquaman"" star bid farewell to his facial hair to raise awareness about plastic waste."	Ben Boskovich	2019-04-18T15:09:00Z	https://hips.hearstapps.com/hmg-prod.s3.amazonaws.com/images/screen-shot-2019-04-18-at-10-43-24-am-1555598678.png?crop=1xw:0.894774011299435xh;center,top&resize=480:*	
Here's How to Actually Get Rid of Razor Bumps	https://www.esquire.com/style/grooming/g27148792/how-to-get-rid-of-razor-bumps/	Look to the best treatment—and prevention.	Christine Flammia	2019-04-15T20:58:00Z	https://hips.hearstapps.com/hmg-prod.s3.amazonaws.com/images/razor-bump-index-1555357710.png?crop=1.00xw:1.00xh;0,0&resize=480:*	
10 Fast-Acting Ways to Completely Shut Down a Surprise Breakout	https://www.esquire.com/style/grooming/g27046701/acne-spot-treatment/	Here's how to keep your skin—and your psyche—clear of irritation.	Christine Flammia	2019-04-08T10:30:00Z	https://hips.hearstapps.com/hmg-prod.s3.amazonaws.com/images/acne-treatment-1554465997.png?crop=1.00xw:1.00xh;0,0&resize=480:*	
