title	href	dek	author	publish_date	thumbnail	sponsor
A Pomade That Won't Let You Down	https://www.esquire.com/style/grooming/advice/a16590/baxter-of-california-clay-pomade-review-11512/	Yes, there's actual clay in it. Maybe that's why it works so well.	Jonathan Evans	2012-11-05T14:24:00Z		
4 Best Showerheads for Men	https://www.esquire.com/style/grooming/a16121/best-showerheads-1112/	It's not just your showerhead. It's your life. And maybe your water bill.		2012-10-07T22:02:00Z	https://hips.hearstapps.com/esq.h-cdn.co/assets/cm/15/07/54d90f115f875_-_esq-01-a-man-and-his-showerhead-1112-q8fvjm-de.jpg?crop=1xw:0.423572744014733xh;center,top&resize=480:*	
"The ""Liquid Gold"" To Make You Look Younger"	https://www.esquire.com/style/grooming/a32987/argan-oil-2012/	Argan oil: get on it.	Matthew Bell	2012-09-21T10:52:00Z	https://hips.hearstapps.com/esq.h-cdn.co/assets/cm/15/07/54daf66ddc060_-_esq-argan-oil-2012-th2.jpg?crop=1xw:0.650000000000000xh;center,top&resize=480:*	
The Grooming Products Worth Splurging On	https://www.esquire.com/style/grooming/a15512/luxury-grooming-product-2012/	Maybe not part of your normal regimen, but that doesn't mean you won't enjoy them	Matthew Bell	2012-08-27T11:04:00Z	https://hips.hearstapps.com/esq.h-cdn.co/assets/cm/15/05/480x240/54ccdf462f488_-_esq-braun-personal-shaver-uimp50-xlg.jpg?resize=480:*	
What's with the Anti-AgingProducts at the Drug Store?	https://www.esquire.com/style/grooming/a32980/anti-aging-products-2012/	In case you think you need them.	Matthew Bell	2012-08-23T10:00:00Z	https://hips.hearstapps.com/esq.h-cdn.co/assets/cm/15/07/54daf6752e16e_-_esq-anti-aging-2012-c7uh2l-lg.jpg?crop=1xw:0.333333333333333xh;center,top&resize=480:*	
Snails: Good for Your Face?	https://www.esquire.com/style/grooming/a15427/snails-for-grooming-2012/	Surprising to us, too.	Matthew Bell	2012-08-21T10:42:00Z	https://hips.hearstapps.com/esq.h-cdn.co/assets/cm/15/05/480x240/54ccdc068bd9a_-_esq-snail-grooming-2012-xlg.jpg?resize=480:*	
Face Acupuncture Is a Thing Now	https://www.esquire.com/style/grooming/a15383/facial-acupuncture-2012/	It's like Botox. Sorta.	Matthew Bell	2012-08-16T16:27:00Z	https://hips.hearstapps.com/esq.h-cdn.co/assets/cm/15/05/480x240/54ccda9485085_-_esq-facial-acupuncture-2012-q31y0o-xlg.jpg?resize=480:*	
Turns Out Sharks Can Be Good For You, Too	https://www.esquire.com/style/grooming/a15340/shark-liver-oil-2012/	A grooming question for Shark Week	Matthew Bell	2012-08-14T16:09:00Z	https://hips.hearstapps.com/esq.h-cdn.co/assets/cm/15/06/54d59d0749651_-_esq-shark-liver-oil-2012-hahyok-lg.jpg?crop=1xw:0.412371134020619xh;center,top&resize=480:*	
The Final Step to WashingYour Face Really Well	https://www.esquire.com/style/grooming/a15060/toner-for-men-2012/	Because the process should not start, and end, with face wash.	Matthew Bell	2012-07-25T10:59:00Z	https://hips.hearstapps.com/esq.h-cdn.co/assets/cm/15/06/54d59af358204_-_esq-kiehls-toner-astringent-ercpeu-xlg.jpg?crop=1xw:0.433212996389892xh;center,top&resize=480:*	
A New Do-Everything Sunscreen and Some Other Beach Solutions	https://www.esquire.com/style/grooming/a14775/grooming-tips-for-the-beach-070612/	And a little grooming advice for the road.	Matthew Bell	2012-07-06T11:28:00Z	https://hips.hearstapps.com/esq.h-cdn.co/assets/cm/15/06/54d59995cf034_-_esq-lab-series-cream-eoi4rp-lg.jpg?crop=1xw:0.357142857142857xh;center,top&resize=480:*	
Anthony Davis TrademarkedHis Unibrow Before the Draft	https://www.esquire.com/style/grooming/a14632/anthony-davis-unibrow-062612/	Who knew you could trademark your facial hair?	Kurt Soller	2012-06-26T10:52:00Z	https://hips.hearstapps.com/esq.h-cdn.co/assets/cm/15/05/480x240/54ccbea2859cc_-_esq-anthony-davis-unibrow-062612-plbvjy-xlg.jpg?resize=480:*	
Michael Phelps, 'Stache-less	https://www.esquire.com/style/grooming/a14611/michael-phelps-mustache-062512/	It's all about the mustache, you see.	Kurt Soller	2012-06-25T10:46:00Z	https://hips.hearstapps.com/esq.h-cdn.co/assets/cm/15/05/54ccbe3f96812_-_esq-michael-phelps-swimmer-062512-765x93-th2.jpg?crop=1xw:0.650000000000000xh;center,top&resize=480:*	
The (Grooming) Reason to Head to the Beach	https://www.esquire.com/style/grooming/a14524/sea-salt-benefits-061912/	This time, it's all about the ocean	Matthew Bell	2012-06-19T14:35:00Z	https://hips.hearstapps.com/esq.h-cdn.co/assets/cm/15/05/54ccbb3abf786_-_esq-axe-sea-salt-jecnzw-th2.jpg?crop=1xw:0.650000000000000xh;center,top&resize=480:*	
Feel-Better Grooming Kit: The Things to Keep at Work	https://www.esquire.com/style/grooming/a14458/hangover-grooming-products-2012/	Some things to use after a long night of heavy drinking	Matthew Bell	2012-06-14T11:29:00Z	https://hips.hearstapps.com/esq.h-cdn.co/assets/cm/15/05/480x240/54ccb8e1bf96e_-_esq-hangover-kit-061412-xlg.jpg?resize=480:*	
Can't Grow a Beard? Lil Help...	https://www.esquire.com/style/grooming/a14262/cannot-grow-beards-0512/	Apparently, this is a source of trauma for many men	Kurt Soller	2012-05-31T12:34:00Z	https://hips.hearstapps.com/esq.h-cdn.co/assets/cm/15/05/480x240/54ccb28d406c2_-_esq-perry-ellis-ads-020712-1z7bsb-xlg.jpg?resize=480:*	
You're Gonna Need More Sunscreen	https://www.esquire.com/style/grooming/advice/a14195/face-sunscreen-052412/	Because that stuff you slather all over your body isn't enough	Matthew Bell	2012-05-24T15:48:00Z	https://hips.hearstapps.com/esq.h-cdn.co/assets/cm/15/07/54d8cacacaf49_-_esq-anthony-logistics-052412-jdth7p-lg.jpg?crop=1xw:0.311688311688312xh;center,top&resize=480:*	
Secrets of the Longest Mustache on Earth	https://www.esquire.com/style/grooming/a14075/mustache-growing-tips-041712/	Don't try this at home.	Kurt Soller	2012-05-17T14:58:00Z	https://hips.hearstapps.com/esq.h-cdn.co/assets/cm/15/05/480x240/54ccabcc701ea_-_esq-14-foot-mustache-051712-xlg.jpg?resize=480:*	
A Lesson in Potentially Dangerous Grooming	https://www.esquire.com/style/grooming/a32978/paraben-free-products-051612/	We've been seeing a lot of talk about preservatives lately	Matthew Bell	2012-05-16T14:38:00Z	https://hips.hearstapps.com/esq.h-cdn.co/assets/cm/15/07/54daf66c6ba05_-_esq-paraben-free-051612-xc5m3u-th2.jpg?crop=1xw:0.650000000000000xh;center,top&resize=480:*	
Funniest New Thing in Your Medicine Cabinet	https://www.esquire.com/style/grooming/a14029/apc-aesop-poo-drops-051412/	Officially a thing: Post-poo drops.	Kurt Soller	2012-05-14T12:25:00Z	https://hips.hearstapps.com/esq.h-cdn.co/assets/cm/15/05/480x240/54cca8f689449_-_esq-aesop-poo-drops-051412-nllijo-xlg.jpg?resize=480:*	
The New Rules of Sunscreen	https://www.esquire.com/style/grooming/a13907/expensive-sunscreen-050212/	As luxe sun treatments start to hit the market, the FDA is stepping in.	Matthew Bell	2012-05-02T13:00:00Z	https://hips.hearstapps.com/esq.h-cdn.co/assets/cm/15/05/54cca49f5a5a6_-_espensive-sunscreen-tcrln3-th2.jpg?crop=1xw:0.650000000000000xh;center,top&resize=480:*	
John Edwards' Hair Problem	https://www.esquire.com/style/grooming/a13890/john-edwards-hair-050112/	As he faces a jury, we're surprised that the fancy candidate doesn't have a better coif	Kurt Soller	2012-05-01T14:53:00Z	https://hips.hearstapps.com/esq.h-cdn.co/assets/cm/15/05/54cca3c9c1bf0_-_esq-john-edwards-trial-hair-050112-n10ehq-th2.jpg?crop=1xw:0.650000000000000xh;center,top&resize=480:*	
The Best Thing for Your Armpits in a Long Time	https://www.esquire.com/style/grooming/a32993/all-natural-antipersperant-043012/	In which we explain why some companies are trying to make sweat-protection more safe	Matthew Bell	2012-04-30T17:57:00Z	https://hips.hearstapps.com/esq.h-cdn.co/assets/cm/15/07/54daf66e9d474_-_esq-antipersperant-toms-043012-udywjr-th2.jpg?crop=1xw:0.650000000000000xh;center,top&resize=480:*	
"Why Grooming Products ""For Men"" Really Work"	https://www.esquire.com/style/grooming/advice/a32992/products-for-men-042612/	An answer to the question plaguing everyone: What makes men's products different than women's?	Kurt Soller	2012-04-26T17:06:00Z	https://hips.hearstapps.com/esq.h-cdn.co/assets/cm/15/07/54daf67a2590c_-_lab-skincare-lg.jpg?crop=1xw:0.400000000000000xh;center,top&resize=480:*	
Your Facial Hair Bible	https://www.esquire.com/style/grooming/a13793/buzzfeed-beard-charts-042312/	Maybe the most clever chart we've ever seen	Kurt Soller	2012-04-23T11:26:00Z	https://hips.hearstapps.com/esq.h-cdn.co/assets/cm/15/05/480x240/54cca0a98b29a_-_esq-beards-chart-042312-bnhl6j-xlg.jpg?resize=480:*	
Should You Use Products with Hemp in Them?	https://www.esquire.com/style/grooming/a13761/hemp-grooming-products-041912/	Getting to the bottom of a relevant grooming debate.	Matthew Bell	2012-04-19T16:01:00Z	https://hips.hearstapps.com/esq.h-cdn.co/assets/cm/15/05/480x240/54cc9fbbedfae_-_esq-hemp-products-041912-xlg.jpg?resize=480:*	
"Grooming: Should You Use a ""Serum"" on Your Face?"	https://www.esquire.com/style/grooming/a32925/serum-vs-face-cream-041212/	In which we explain the various ways a man can add some moisture back into his facial skin	Matthew Bell	2012-04-12T14:30:00Z	https://hips.hearstapps.com/esq.h-cdn.co/assets/cm/15/07/480x240/54daf60028beb_-_esq-malin-goetz-face-cream-041212-xlg.jpg?resize=480:*	
The Surprise New Way to Stock Your Medicine Cabinet, for $20!	https://www.esquire.com/style/grooming/a13610/birchbox-man-launches-041012/	With the launch of Birchbox Man, you've got no excuse to run out of deodorant	Kurt Soller	2012-04-10T13:52:00Z	https://hips.hearstapps.com/esq.h-cdn.co/assets/cm/15/05/480x240/54cc9a6ae1a95_-_esq-birchbox-man-041012-xlg.jpg?resize=480:*	
The Spring 2012 Hair Upgrade, Movie-Star Edition	https://www.esquire.com/style/grooming/a13600/new-summer-haircuts-for-men-040912/	Because warmer weather calls for a few simple changes	Kurt Soller	2012-04-10T09:00:00Z	https://hips.hearstapps.com/esq.h-cdn.co/assets/15/17/4000x2000/landscape-1429899208-461991224.jpg?resize=480:*	
Unibrow Cure for Anthony Davis, Joe Flacco, and Maybe You	https://www.esquire.com/style/grooming/advice/a13537/joe-flacco-unibrow-04012/	Too many unibrows, so little time. Here's how to get rid of them.	Kurt Soller	2012-04-04T10:26:00Z	https://hips.hearstapps.com/esq.h-cdn.co/assets/cm/15/05/480x240/54cc987153370_-_esq-unibrow-nation-040412-lg.jpg?resize=480:*	
Jason Jones on The New Laws of Shaving	https://www.esquire.com/style/grooming/a13487/jason-jones-shaving-advice-040212/	The Daily Show correspondent shares the five new tricks every man should follow when wielding a razor	Jason Jones	2012-04-02T11:52:00Z	https://hips.hearstapps.com/esq.h-cdn.co/assets/cm/15/05/54cc96a04b380_-_esq-jason-jones-shaving-040212-nypvp8-t.jpg?crop=1xw:0.650000000000000xh;center,top&resize=480:*	
Ron Burgundy's Mustache, Shaved for Anchorman 2	https://www.esquire.com/style/grooming/a13454/ron-burgundy-mustache-anchorman-2-032912/	In which we imagine what Will Ferrell's character would look like without a mustache	Kurt Soller	2012-03-29T12:57:00Z	https://hips.hearstapps.com/esq.h-cdn.co/assets/cm/15/05/54cc9583d90dc_-_esq-ron-burgundy-mustache-0312-gpgurl-th2.jpg?crop=1xw:0.650000000000000xh;center,top&resize=480:*	
How About That Supreme Court Lawyer's Mustache?	https://www.esquire.com/style/grooming/a13415/donald-verrilli-jr-mustache-032712/	Our current Solicitor General is now in the spotlight, and with one helluva mustache	Kurt Soller	2012-03-27T16:36:00Z	https://hips.hearstapps.com/esq.h-cdn.co/assets/cm/15/05/480x240/54cc939626069_-_esq-donald-verrilli-mustache-032712-azldl1-xlg.jpg?resize=480:*	
Should You Ever Try a Scalp Treatment?	https://www.esquire.com/style/grooming/a13246/scalp-treatment-for-men-031612/	The latest entry in our guide to treatments worth your time at the spa: The ins and outs of scalp treatments	Kurt Soller	2012-03-16T15:03:00Z	https://hips.hearstapps.com/esq.h-cdn.co/assets/cm/15/05/480x240/54cc8e3aa0b31_-_esq-scalp-treatment-031612-xlg.jpg?resize=480:*	
Jake Gyllenhaal's Extreme Shave	https://www.esquire.com/style/grooming/a13209/jake-gyllenhaal-sounds-video-shave-031412/	One well-made music video and a razor to the face that might make you wince	Kurt Soller	2012-03-14T10:27:00Z	https://hips.hearstapps.com/esq.h-cdn.co/assets/cm/15/05/54cc8c4299b38_-_esq-jake-gyllenhaal-shoes-031412-djurmp-th2.jpg?crop=1xw:0.650000000000000xh;center,top&resize=480:*	
Should You Ever Get a Body Scrub?	https://www.esquire.com/style/grooming/a12835/mens-body-scrub-spa-treatment-0312/	The latest entry in our guide to treatments worth your time at the spa	Kurt Soller	2012-03-05T11:06:00Z	https://hips.hearstapps.com/esq.h-cdn.co/assets/cm/15/05/480x240/54cc7dfc6bd41_-_esq-body-scrub-2012-xlg.jpg?resize=480:*	
Should You Try Moisturizer with Stem Cells?	https://www.esquire.com/style/grooming/a12818/stem-cell-moisturizing-treatment-0229/	The latest entry in our guide to treatments worth your time at the spa		2012-02-28T11:19:00Z	https://hips.hearstapps.com/esq.h-cdn.co/assets/cm/15/05/480x240/54cc7e048fb9c_-_esq-cellure-skin-care-022812-xlg.jpg?resize=480:*	
A New Way to Cut Your Shower Time In Half	https://www.esquire.com/style/grooming/a12976/dial-speed-foam-022712/	A new product is sprayed onto your body like your shaving cream. But is it worth it?	Jake Stavis	2012-02-27T17:49:00Z	https://hips.hearstapps.com/esq.h-cdn.co/assets/cm/15/05/54cc84888006b_-_esq-dial-speed-foam-022712-bzudjp-th2.jpg?crop=1xw:0.650000000000000xh;center,top&resize=480:*	
Should You Consider Putting Caviar on Your Face?	https://www.esquire.com/style/grooming/a12815/la-prairie-moisturizer-review-021712/	The latest entry in our guide to treatments worth your time when you visit the spa	Kurt Soller	2012-02-17T13:54:00Z	https://hips.hearstapps.com/esq.h-cdn.co/assets/cm/15/05/480x240/54cc7e023350a_-_esq-caviar-skin-cream-021712-xlg.jpg?resize=480:*	
Meet Your Favorite New Razor	https://www.esquire.com/style/grooming/advice/a12804/gilette-fusion-proglide-styler-review-021412/	The Gillette Fusion ProGlide Styler is fantastic. As long as you dont use it to shave.	Peter Martin	2012-02-14T14:13:00Z	https://hips.hearstapps.com/esq.h-cdn.co/assets/cm/15/05/480x240/54cc7d87c371e_-_esq-gilette-style-021412-xlg.jpg?resize=480:*	
How to Look Better at Work Than You Did on Super Bowl Monday	https://www.esquire.com/style/grooming/advice/a12591/shave-at-work-6651706/	You cannot shave as well as Andre Benjamin or Adrien Brody, but an office secret might save you yet.	Matt Sullivan	2012-02-06T00:08:00Z		
How Facial Hair Can Win The Globes Red Carpet	https://www.esquire.com/style/grooming/a12374/golden-globes-fashion-2012/	The men who show up on Sunday with some stubble will likely have the best look	Kurt Soller	2012-01-13T12:13:00Z	https://hips.hearstapps.com/esq.h-cdn.co/assets/cm/15/06/480x240/54d59f5138e81_-_esq-golden-globes-facial-hair-2012-xlg.jpg?resize=480:*	
The Best New Colognes of 2012, According to Ellie Kemper	https://www.esquire.com/style/grooming/advice/g1031/best-colognes-2012/	The Style Blog's cologne correspondent, fresh from The Office, on what new bottles smell like to funny, attractive women with working n…	Ellie Kemper	2012-01-10T17:07:00Z	https://hips.hearstapps.com/esq.h-cdn.co/assets/cm/15/06/54d59e6e1f7f3_-_esq-1-a-ellie-kemper-011212-lg-46795794.jpg?crop=1xw:0.380855397148676xh;center,top&resize=480:*	
$6 Secret to a Fantastic Shave	https://www.esquire.com/style/grooming/a12265/shave-secret-product-010412/	At one of the best salons in New York, a barber showed us the affordable product he relies on now	Kurt Soller	2012-01-04T14:34:00Z	https://hips.hearstapps.com/esq.h-cdn.co/assets/cm/15/05/54cc65a125ccf_-_esq-shave-secret-010412-naaumc-th2.jpg?crop=1xw:0.650000000000000xh;center,top&resize=480:*	
Best and Worst Celebrity Hairto Bring to the Barber in 2012	https://www.esquire.com/style/grooming/a12183/celebrity-grooming-mistakes-0112/	From exemplary (Jon Hamm, Robert Downey) to, well, Conan, a helpful guide	Rodney Cutler	2011-12-26T11:49:00Z	https://hips.hearstapps.com/esq.h-cdn.co/assets/cm/15/05/480x240/54cc61e8668cb_-_esq-celebrity-grooming-0112-dwc8yk-xlg.jpg?resize=480:*	
Now, The Kiehl's Experts Teach You to Shave	https://www.esquire.com/style/grooming/a12087/shaving-correctly-for-men-2011/	A new video, made for the luxury gym chain Equinox, is chock full of tips you'll use now	Kurt Soller	2011-12-15T18:08:00Z	https://hips.hearstapps.com/esq.h-cdn.co/assets/cm/15/05/480x240/54cc5dc60a3ed_-_esq-equinox-shave-tips-1215111-xlg.jpg?resize=480:*	
So This Is the Coolest Haircut?	https://www.esquire.com/style/grooming/a11753/trendy-haircuts-for-men-2011/	In the New York Times, they've discovered a new haircut. Well, actually, one that's been popular since the 1930s.	Kurt Soller	2011-11-17T17:49:00Z	https://hips.hearstapps.com/esq.h-cdn.co/assets/cm/15/05/480x240/54cc4f1baf789_-_esq-michael-pitt-haircut-111711-xlg.jpg?resize=480:*	
Report: Women Prefer Stubble	https://www.esquire.com/style/grooming/a11727/women-prefer-stubble-111611/	A new study shows that women prefer the facial hair that George Clooney first made famous.	Kurt Soller	2011-11-14T18:33:00Z	https://hips.hearstapps.com/esq.h-cdn.co/assets/cm/15/07/480x240/54d8ce90f2693_-_esq-george-clooney-stubble-111411-eqnmfp-xlg.jpg?resize=480:*	
A One-Stop Solution to Better, Easier Grooming	https://www.esquire.com/style/grooming/advice/a11686/birchbox-for-men-111211/	After a few years of going after the ladies, Birchbox finally has something you can use for yourself	Kurt Soller	2011-11-14T12:57:00Z	https://hips.hearstapps.com/esq.h-cdn.co/assets/cm/15/05/480x240/54cc49dcdd791_-_birchbox-mens-111211-qmdc5w-xlg.jpg?resize=480:*	
R.I.P. Romney's Perfect Hair	https://www.esquire.com/style/grooming/a11653/mitt-romney-haircut-111011/	The candidate has always had an enviable coif. Somehow, it got lost on the way to Michigan's debate.	Kurt Soller	2011-11-10T11:22:00Z	https://hips.hearstapps.com/esq.h-cdn.co/assets/cm/15/05/480x240/54cc48336d2c8_-_esq-mitt-romney-hair-111011-dujued-xlg.jpg?resize=480:*	
A Man in His Office: The Blind Barber's Adam Kirsch	https://www.esquire.com/style/grooming/g956/blind-barber-adam-kirsch-office-102411/	The business mind behind one of our favorite barber-by-day, bar-by-night hotspots in New York (and, soon, L.A.) shows us the coolest st…		2011-10-24T13:20:00Z	https://hips.hearstapps.com/esq.h-cdn.co/assets/cm/15/05/54cc38a5eab7b_-_blind-barber-adam-102411-th2-83993006.jpg?crop=1xw:0.650000000000000xh;center,top&resize=480:*	
20 Ways to Get Perfect Skin...	https://www.esquire.com/style/grooming/advice/a11361/skin-care-for-men-6518382/	We asked a doctor why men have skin and beards that are so dry and itchy, plus the best ways to fix these issues on your own terms		2011-10-19T08:00:00Z	https://hips.hearstapps.com/esq.h-cdn.co/assets/cm/15/05/54cc35e21ce46_-_esq-men-shaving-101811-svuxfx-th2.jpg?crop=1xw:0.650000000000000xh;center,top&resize=480:*	
The Style Blog Presents: Manliest Hair Alive	https://www.esquire.com/style/grooming/a11253/new-fall-hair-for-men-2011/	From the box office, to the convenience store, to your local barbershop, these are the cuts and products for right now	Kurt Soller	2011-10-11T06:15:00Z	https://hips.hearstapps.com/esq.h-cdn.co/assets/cm/15/05/480x240/54cc305e0d984_-_esq-marvel-manliest-hair-101111-3qwthu-xlg.png?resize=480:*	
The Manliest Hair Alive: Fall 2011 Edition	https://www.esquire.com/style/grooming/g943/best-fall-hair-for-men-6510717/	At the box office, the convenience store, and your local barbershop, these are the cuts, products, and new ideas to know now.	The Fashion Editors	2011-10-11T06:14:00Z	https://hips.hearstapps.com/esq.h-cdn.co/assets/15/17/480x240/landscape-1429931203-manilest-hair-alive.jpg?resize=480:*	
Ides of March: Steal George Clooney's New Haircut	https://www.esquire.com/style/grooming/advice/a11205/george-clooney-ides-of-march-haircut-6508269/	In the new political film that's out this weekend, Hollywood's best hair has a new look that's just right for fall	Kurt Soller	2011-10-07T11:17:00Z	https://hips.hearstapps.com/esq.h-cdn.co/assets/cm/15/05/480x240/54cc2e37782e0_-_esq-george-clooney-ides-of-march-100711-hmznsj-xlg.jpg?resize=480:*	
How to Easily Upgrade Your Grooming Regimen	https://www.esquire.com/style/grooming/a11100/drug-store-products-men-2011/	Fall isn't just about clothes, it's about looking great and all the rugged glory that comes with a beard, some new hair, and these fin…	The Fashion Editors	2011-09-30T17:05:00Z	https://hips.hearstapps.com/esq.h-cdn.co/assets/cm/15/05/480x240/54cc2a9f8c9f1_-_esq-grooming-awards-2011-un2do6-xlg.jpg?resize=480:*	
The 2011 Esquire Grooming Awards	https://www.esquire.com/style/grooming/g929/mens-grooming-products-2011-1011/	Once again, I've gone through hundreds of gels and creams in search of the best new products for men		2011-09-27T01:30:00Z	https://hips.hearstapps.com/esq.h-cdn.co/assets/cm/15/18/55415e481a63e-esq-01-old-spice-1011-lg-57479844.jpg?crop=1xw:0.375000000000000xh;center,top&resize=480:*	
10 Essential Navy Blazers for Fall	https://www.esquire.com/style/grooming/a10995/navy-sport-coats-for-men-2011-6475019/	We've scoured the web to find ten new navy jackets that will be great updates to your fall essentials	Kurt Soller	2011-09-22T11:41:00Z	https://hips.hearstapps.com/esq.h-cdn.co/assets/cm/15/05/480x240/54cc25e99127b_-_esq-gant-rugger-blazer-092211-wtebzx-xlg.jpg?resize=480:*	
Fashion Week-Worthy Stubble	https://www.esquire.com/style/grooming/a10875/fashion-week-facial-hair-for-men-090911/	Backstage at Duckie Brown, we learned the ins and outs of having some well-maintained stubble this season.	Kurt Soller	2011-09-09T12:18:00Z	https://hips.hearstapps.com/esq.h-cdn.co/assets/cm/15/05/480x240/54cc209c0a085_-_esq-steven-cox-grooming-090911-lzhiks-xlg.jpg?resize=480:*	
Letterman Invents Death-Proof Hairpieces for Men	https://www.esquire.com/style/grooming/a10728/david-letterman-death-threat-top-ten-list-video-6310351/	David Letterman's death threat Top Ten list a video, and maybe some hair advice	Matt Sullivan	2011-08-23T10:26:00Z		
How to Live a Life Without Hair Gel	https://www.esquire.com/style/grooming/a10761/hair-treatments-for-men-081711/	"A new ""hair treatment"" for men promises that you won't have to style your hair each morning. Is it worth it?"	Peter Martin	2011-08-17T16:46:00Z	https://hips.hearstapps.com/esq.h-cdn.co/assets/cm/15/06/54d5a8c5b12a3_-_esq-barber-shop-treatment-081711-lg.jpg?crop=1xw:0.431654676258993xh;center,top&resize=480:*	
How to Grow the Most Extreme Facial Hair Ever	https://www.esquire.com/style/grooming/g882/whisker-wars-beards-6204306/	A new television show, Whisker Wars, follows the competitive world of beard competitions. Gentlemen, meet you match.		2011-08-05T09:59:00Z	https://hips.hearstapps.com/esq.h-cdn.co/assets/cm/15/18/768x384/55414ebf19e7f-alex-1-xl.jpg?resize=480:*	
The Commmonsense Guide to Grooming	https://www.esquire.com/style/grooming/g874/mens-grooming-guide-summer-0811/	Featuring: beard oil, facial masks, back waxing, laser hair removal, eye cream, Ryan Seacrest, one man willing to get a little Botox, a…		2011-08-01T14:01:00Z	https://hips.hearstapps.com/esq.h-cdn.co/assets/cm/15/16/768x384/landscape-54cc12f73c29c-esq-grooming-guide-072911-xlg.jpg?resize=480:*	
Manliest Old Spice Man So Far...	https://www.esquire.com/style/grooming/a10616/old-spice-internet-duel-winner-6154537/	Our early odds on who deserves to win Old Spice's campaign for spokesman supremacy	Kurt Soller	2011-07-26T16:17:00Z	https://hips.hearstapps.com/esq.h-cdn.co/assets/cm/15/05/54cc114f4a8b7_-_esq-old-spice-man-072611-th2.jpg?crop=1xw:0.650000000000000xh;center,top&resize=480:*	
Six Ways to Smell Famous	https://www.esquire.com/style/grooming/a10513/celebrity-colognes-for-men-070710/	With the onslaught of celebrity-inspired colognes for men, we smelled each and offered up the right place to wear six new ones	Michael Stefanov	2011-07-07T13:40:00Z	https://hips.hearstapps.com/esq.h-cdn.co/assets/cm/15/05/480x240/54cc0c6adb3f5_-_esq-patrick-dempsey-070711-xlg.jpg?resize=480:*	
How to Have Hair Like a Rockstar	https://www.esquire.com/style/grooming/a10091/bonnaroo-music-festival-hair-5920238/	From Kanye to Chris Martin to that guy from the Strokes, how to let it hang a bit looser in the summer months at Bonaroo and other mus…		2011-06-14T18:36:00Z		
The Problem with Weiner's Chest	https://www.esquire.com/style/grooming/a10071/anthony-weiner-waxed-chest-5879414/	Reporters pounced on the leaked cell phone photos by Congressman Anthony Weiner, but they missed one question: Do you wax?	Peter Martin	2011-06-07T12:49:00Z	https://hips.hearstapps.com/esq.h-cdn.co/assets/cm/15/05/480x240/54cbfdb7e7d9a_-_esq-anthony-weiner-waxed-chest-060711-xlg.jpg?resize=480:*	
What Famous Bearded Men Would Have Looked Like if They'd Shaved	https://www.esquire.com/style/grooming/advice/g788/men-with-beards/	Just think what some of the greats could have accomplished, if only they'd been properly groomed		2011-04-15T00:03:00Z	https://hips.hearstapps.com/esq.h-cdn.co/assets/cm/15/05/768x384/54cb9741c9d66_-_esq-02-king-tut-shave-041411-xlg.jpg?resize=480:*	
Five Ways to Start Going Bald...and Still Look Like Royalty	https://www.esquire.com/style/grooming/g783/bald-haircut-styles-0411/	Everything you need to know about dealing with your hair. What's left of it, at least.		2011-04-11T13:48:00Z	https://hips.hearstapps.com/esq.h-cdn.co/assets/15/07/clipper.jpg?crop=1xw:0.375000000000000xh;center,top&resize=480:*	
A World Without Balding	https://www.esquire.com/style/grooming/a9773/cure-for-balding-5430612/	Scientists are coming closer every day to eliminating the threat of male pattern hair loss. But how close? And even more: Does it matte…	Eryn Green	2011-03-21T08:30:00Z	https://hips.hearstapps.com/esq.h-cdn.co/assets/cm/15/05/54cb90192e0fd_-_balding-4601.jpg?crop=1xw:0.575000000000000xh;center,top&resize=480:*	
