title	href	dek	author	publish_date	thumbnail	sponsor
Shades of Gray: The Men Who Rock Silver Hair Right	https://www.esquire.com/style/grooming/g2029/shades-of-gray-guys-who-up-the-style-ante-with-silver/	From George Clooney to the Most Interesting Man In the World, these guys do justice to their graying hair.	Heidi Davis	2015-02-13T17:16:00Z	https://hips.hearstapps.com/esq.h-cdn.co/assets/15/07/4000x2000/landscape_1423845002-al464618925.jpg?resize=480:*	
How to Avoid Robert Pattinson's Beard Mistake	https://www.esquire.com/style/grooming/a32684/robert-pattionsons-weird-beard-021015/	Bad beard trimming can ruin even one of Hollywood's handsomest faces.	Andrew D. Luecke	2015-02-10T11:48:00Z	https://hips.hearstapps.com/esq.h-cdn.co/assets/cm/15/07/1024x512/54dad42fd5458_-_share-jr0mnh.jpg?resize=480:*	
Research Says Women of Tinder Don't Like Beards	https://www.esquire.com/style/grooming/a32478/women-on-tinder-dont-like-beards-020514/	According to a study by Gillette and Tinder, clean-shaven men get all the right-swipes.	Andrew D. Luecke	2015-02-04T17:30:00Z	https://hips.hearstapps.com/esq.h-cdn.co/assets/cm/15/07/1024x512/54d951a595550_-_share-uvtlob.jpg?resize=480:*	
Hero Barber Gives Misbehaving Kids Old Man Haircuts	https://www.esquire.com/style/grooming/news/a32571/barber-kids-old-man-haircut/	You can't fault his creativity.	John Hendrickson	2015-02-04T13:25:00Z	https://hips.hearstapps.com/esq.h-cdn.co/assets/cm/15/07/1024x512/54da2dbf553b0_-_barberoldmancut-1200.png?resize=480:*	
When Celebrities Shave Off Their Iconic Mustaches	https://www.esquire.com/style/grooming/a32367/iconic-mustache-shaving/	It's always jarring to see famously mustachioed men without their 'staches.	Ryan Bort	2015-01-26T17:08:00Z	https://hips.hearstapps.com/esq.h-cdn.co/assets/cm/15/06/480x240/54d1762927517_-_offerman620-14100406.jpg?resize=480:*	
How To Get David Beckham's New Haircut	https://www.esquire.com/style/grooming/advice/a32292/david-beckham-haircut/	It's not as complicated as it looks.	Sam Parker	2015-01-22T10:48:00Z	https://hips.hearstapps.com/esq.h-cdn.co/assets/cm/15/06/1024x512/54d4646024713_-_davidbeckhamhair-1200.jpg?resize=480:*	
5 Grooming Areas You Cannot Neglect (But Often Do)	https://www.esquire.com/style/grooming/advice/a32369/grooming-problem-areas-011615/	Please don't neglect these forgotten grooming problem spots.	Andrew D. Luecke	2015-01-16T13:40:00Z	https://hips.hearstapps.com/esq.h-cdn.co/assets/15/16/4000x2000/landscape-1429185749-sb10064243t-001.jpg?resize=480:*	
Warning: Rainbow Beards Have Arrived	https://www.esquire.com/style/grooming/a32329/dying-beards-latest-trend-011515/	What color is your beard parachute?	Andrew D. Luecke	2015-01-15T16:56:00Z	https://hips.hearstapps.com/esq.h-cdn.co/assets/cm/15/06/1024x512/54d4637eae6f7_-_sharebeard.jpg?resize=480:*	
2015: The Year of the Beard at the Golden Globes	https://www.esquire.com/style/grooming/a32281/golden-globes-2015-beards/	Facial hair was everywhere we looked.	Diana Bruk	2015-01-12T13:15:00Z	https://hips.hearstapps.com/esq.h-cdn.co/assets/cm/15/06/1024x512/54d4614ce8545_-_esq-beard-de.jpg?resize=480:*	
12 Perplexing Grooming Transformations Men Embraced in 2014	https://www.esquire.com/style/grooming/g2021/guy-hair-transformation-2014-esqsyn/	Erm, gentlemen...	Megan Cahn	2015-01-08T13:17:00Z	https://hips.hearstapps.com/esq.h-cdn.co/assets/cm/15/07/480x240/54d9500631347_-_aafc36a280c_-_elle-00-guy-hair-transformations-opener-h-elh.jpg?resize=480:*	
A Gift That You Can Carry On	https://www.esquire.com/style/grooming/a32138/richer-poorer-carry-on-dopp-kit-121614/	Whether you gift it to a friend or keep it for yourself, The Carry On pack from Richer Poorer and Topo Designs is the perfect holiday p…	Andrew D. Luecke	2014-12-16T10:45:00Z	https://hips.hearstapps.com/esq.h-cdn.co/assets/cm/15/06/1024x512/54d45a9792783_-_share-qaqvt7.jpg?resize=480:*	
Beard Baubles Are Hipster Christmas Ornaments for Your Face	https://www.esquire.com/style/grooming/a32169/beard-baubles-121014-dupe/	Be a sane person, hang an ornament on your face.	Andrew D. Luecke	2014-12-10T14:47:00Z		
Beard Baubles Are Hipster Christmas Ornaments for Your Face	https://www.esquire.com/style/grooming/a32493/beard-baubles-121014/	Be a sane person, hang an ornament on your face.	Andrew D. Luecke	2014-12-10T14:47:00Z	https://hips.hearstapps.com/esq.h-cdn.co/assets/cm/15/06/1024x512/54d459fff38aa_-_share-tkdnno.jpg?resize=480:*	
Maintenance: The True Classics	https://www.esquire.com/style/grooming/g2016/maintenance-the-true-classics-120414/	All the retro-inspired elixirs look good in medicine cabinets, but we admire those that have been getting it right for decades.	Rodney Cutler	2014-12-04T13:33:00Z	https://hips.hearstapps.com/esq.h-cdn.co/assets/cm/15/07/54d953158feb0_-_1a71ml3peanul_sl1500_.jpg?crop=1xw:0.359615384615385xh;center,top&resize=480:*	
These Are the Most Luxurious Shaves in America	https://www.esquire.com/style/grooming/g2004/6-most-luxurious-shaves-in-america-120414/	Celebrate the end of Movember with one of these amazing shaves.	Chadner Navarro	2014-12-04T09:00:00Z	https://hips.hearstapps.com/esq.h-cdn.co/assets/15/07/1024x512/landscape_1423618015-shaving-share.jpg?resize=480:*	
The 4 Most Important Facts About Beards, Sex, and Attraction	https://www.esquire.com/style/grooming/a32028/beards-and-sexual-attraction-12-1314/	Everything you need to know to get the most out of your facial hair.	Andrew D. Luecke	2014-12-03T12:33:00Z	https://hips.hearstapps.com/esq.h-cdn.co/assets/cm/15/06/1024x512/54d456afe183b_-_esq-beards-attraction-share.jpg?resize=480:*	
Why Are So Many CEO's Growing Beards?	https://www.esquire.com/style/grooming/a32108/ceos-beards-success/	It all comes down to the economy, of course.	John Hendrickson	2014-12-01T13:45:00Z	https://hips.hearstapps.com/esq.h-cdn.co/assets/cm/15/06/1024x512/54d455cbe0a12_-_larryellisonbeardceo-1200.jpg?resize=480:*	
Fall/Winter Skincare Essentials	https://www.esquire.com/style/grooming/a32029/fall-winter-skincare-essentials/	Treat your face and body right this season.	Calum Marsh	2014-11-20T09:00:00Z	https://hips.hearstapps.com/esq.h-cdn.co/assets/cm/15/06/2048x1024/54d175b3dab58_-_01-man-washing-face-de.jpg?resize=480:*	
Five Essential Bathroom Accessories	https://www.esquire.com/style/grooming/a31962/essential-bathroom-accessories/	5 Things Every Guy Needs in His Medicine Cabinet	Calum Marsh	2014-11-13T10:50:00Z	https://hips.hearstapps.com/esq.h-cdn.co/assets/cm/15/06/2048x1024/54d175b27356f_-_esq-porche-bathroom-essentials-def.jpg?resize=480:*	
Is Kevin Smith Even Himself Without His Beard?	https://www.esquire.com/style/grooming/a23630/kevin-smith-shaves-beard-102814/	"Take a look for yourself. We're pretty sure this is the most official ""death of the beard"" moment yet."	Andrew D. Luecke	2014-10-28T11:45:00Z	https://hips.hearstapps.com/esq.h-cdn.co/assets/cm/15/09/2048x1024/54ece13146cd0_-_esq-kevin-smith-beard-102814-xxl.jpg?resize=480:*	
To Shampoo Or Not To Shampoo	https://www.esquire.com/style/grooming/a30455/to-wash-or-not-to-wash/	For that is the question. And the answer is obvious.	James Joiner	2014-10-21T16:44:00Z	https://hips.hearstapps.com/esq.h-cdn.co/assets/cm/15/06/2048x1024/54d4487f11801_-_shampooheader.jpg?resize=480:*	
Here's How to NOT Shave Your Beard	https://www.esquire.com/style/grooming/advice/a30360/jose-enrique-stache-problems-100914/	Unless you want the entirety of the Internet to hate you	Andrew D. Luecke	2014-10-09T17:08:00Z	https://hips.hearstapps.com/esq.h-cdn.co/assets/cm/15/06/2048x1024/54d4451a91129_-_esq-joes-enrique-hitler-stache-100914-g8ghwe-xxl.jpg?resize=480:*	
The Life and Death of a Beard, Now in Captivating Video	https://www.esquire.com/style/grooming/a30376/beard-video-100914/	See a beard live and die in one minute	Andrew D. Luecke	2014-10-09T13:36:00Z	https://hips.hearstapps.com/esq.h-cdn.co/assets/cm/15/06/2048x1024/54d444f404f2b_-_esq-life-and-death-of-a-beard-100914-xxl.jpg?resize=480:*	
Apparently the iPhone 6 is Destroying Beards	https://www.esquire.com/style/grooming/a30294/iphone-6-beardgate-100714/	This thing can't catch a break.	Andrew D. Luecke	2014-10-07T14:45:00Z	https://hips.hearstapps.com/esq.h-cdn.co/assets/cm/15/06/54d443491f143_-_esq-iphone-beardgate-100714-xxl.jpg?crop=1xw:0.749185667752443xh;center,top&resize=480:*	
Waylon Jennings' Family Sold Willie Nelson's Braids For $25 Grand	https://www.esquire.com/style/grooming/a30249/waylon-jennings-auction/	And that's just the start of it.	James Joiner	2014-10-06T14:42:00Z	https://hips.hearstapps.com/esq.h-cdn.co/assets/cm/15/06/2048x1024/54d4427d080b3_-_jenningsheader.jpg?resize=480:*	
Nick Offerman Explains Why Manscaping is an Abonimation	https://www.esquire.com/style/grooming/videos/a30210/nick-offerman-conan-manscaping/	"""You should be giving off a hot musk that you can almost taste."""	Ryan Bort	2014-10-02T10:37:00Z	https://hips.hearstapps.com/esq.h-cdn.co/assets/cm/15/06/1600x800/54d4418e3a1bd_-_manscapinghires.png?resize=480:*	
How Brett Favre Got His Groom Back	https://www.esquire.com/style/grooming/a30160/brett-favre-101014/	It involves a nose hair trimmer.	Andrew D. Luecke	2014-10-01T18:08:00Z		
Can This Goofy Laser Helmet Really Cure Baldness?	https://www.esquire.com/style/grooming/a30127/igrow-092514/	The FDA thinks so.	Andrew D. Luecke	2014-09-25T14:08:00Z	https://hips.hearstapps.com/esq.h-cdn.co/assets/cm/15/06/2048x1024/54d43ec52bfaf_-_esq-igrow-092514-xxl.jpg?resize=480:*	
What Happened to Commissioner Gordon's Mustache?	https://www.esquire.com/style/grooming/a30048/james-gordon-gotham/	Baby-faced Ben McKenzie does not look like the James Gordon we know and love. Here's why.	John Hendrickson	2014-09-22T17:35:00Z	https://hips.hearstapps.com/esq.h-cdn.co/assets/cm/15/06/480x240/54d43e2c5cdd2_-_mckenziestache-fayf0f-620.jpg?resize=480:*	
Vin Diesel Now Has A Fake Beard To Go With His Fake Name	https://www.esquire.com/style/grooming/a30066/vin-diesel-beard/	And a pretty intense undercut, too.	John Hendrickson	2014-09-22T12:03:00Z	https://hips.hearstapps.com/esq.h-cdn.co/assets/cm/15/06/480x240/54d43dfede959_-_vindieselbeard-620.jpg?resize=480:*	
To Bead Or Not To Bead?	https://www.esquire.com/style/grooming/a30050/toothpaste-plastic-beads/	Plastic microbeads found in facial scrubs, body wash, and toothpaste have long been suspected of doing more harm than good. Now, there'…	John Hendrickson	2014-09-18T13:19:00Z	https://hips.hearstapps.com/esq.h-cdn.co/assets/cm/15/06/480x240/54d43d20361a3_-_crest-620.jpg?resize=480:*	
The Best Way To Deal With Your Receding Hairline	https://www.esquire.com/style/grooming/advice/a30116/receding-hairline-tips/	Did LeBron James just magically fix his receding hairline? Who knows. More important: Who cares?	John Hendrickson	2014-09-17T15:44:00Z	https://hips.hearstapps.com/esq.h-cdn.co/assets/cm/15/06/480x240/54d43ccd73b36_-_lbjhairline-620.jpg?resize=480:*	
Try This For Your Next Shave	https://www.esquire.com/style/grooming/a30077/harrys-shave-gel/	One of our favorite shaving companies, Harry's, just released two new products to make your next shave even easier.	John Hendrickson	2014-09-17T09:00:00Z	https://hips.hearstapps.com/esq.h-cdn.co/assets/cm/15/06/480x240/54d43ca8e9e3a_-_harrys_08-13-14_group_w_gel_01.jpg?resize=480:*	
Maintenance: Time to Start Using Oils	https://www.esquire.com/style/grooming/g1840/maintenance-time-to-start-using-oils-091614/	Don't like that greasy feeling? Then ditch the damn creams.	Rodney Cutler	2014-09-16T09:00:00Z	https://hips.hearstapps.com/esq.h-cdn.co/assets/cm/15/07/54d9463e5b57d_-_esq-oils-091614-xl-1.jpg?crop=1xw:0.359615384615385xh;center,top&resize=480:*	
Actually, Dads, Maybe You Shouldn't Shave That Beard After All	https://www.esquire.com/style/grooming/a29951/dad-shaves-beard-091514/	"Either that, or just don't ""prank"" your baby."	Andrew D. Luecke	2014-09-15T11:49:00Z	https://hips.hearstapps.com/esq.h-cdn.co/assets/cm/15/06/1024x512/54d43ad9ce87e_-_esq-dads-beards-091514-xxl.jpg?resize=480:*	
How Arcade Fire Gave Us The Defining Haircut Of The Decade	https://www.esquire.com/style/grooming/a30017/arcade-fire-win-butler-haircut/	Win Butler's undercut still has scores of imitators. Not least, Brad Pitt and Aaron Paul.	John Hendrickson	2014-09-12T17:47:00Z	https://hips.hearstapps.com/esq.h-cdn.co/assets/cm/15/06/54d43aabbc486_-_winbutler-130.jpeg?crop=1xw:0.643564356435644xh;center,top&resize=480:*	
Your Beard Could Be Scaring Your Kids	https://www.esquire.com/style/grooming/a30030/beards-spot-091114/	Advertisers and scientists know it, so you probably should too.	Andrew D. Luecke	2014-09-11T09:00:00Z	https://hips.hearstapps.com/esq.h-cdn.co/assets/cm/15/06/1024x512/54d439b57bde9_-_esq-beard-091114-xxl.jpg?resize=480:*	
These Rowing Blazers Command Attention	https://www.esquire.com/style/grooming/a29920/rowing-blazers-book/	A look at some of the best jackets from around the world.	John Hendrickson	2014-09-02T10:23:00Z	https://hips.hearstapps.com/esq.h-cdn.co/assets/cm/15/06/640x320/54d435adc6db5_-_stjosephscollege-650.jpeg?resize=480:*	
A New Study Says Women Don't Like Your Beard as Much as You Do	https://www.esquire.com/style/grooming/a29928/new-beard-study-says-women-dont-like-as-much-as-you-do-082914/	Beard fatigue or simple distaste, women aren't feeling your beards, guys.	Andrew D. Luecke	2014-08-29T08:30:00Z	https://hips.hearstapps.com/esq.h-cdn.co/assets/cm/15/06/1024x512/54d434e5bcff5_-_esq-beard-508649941-share.jpg?resize=480:*	
Salvador Dali Said No to Ironic Facial Hair and So Should You	https://www.esquire.com/style/grooming/a29752/salvador-dali-says-no-to-ironic-facial-hair-082214/	One of the 20th Century's greatest aestheticians on owning your personal style.	Andrew D. Luecke	2014-08-22T14:53:00Z		
Fallon Gives Jared Leto A Much-Needed Beard Trim	https://www.esquire.com/style/grooming/a29751/jared-leto-jimmy-fallon/	The beard was out of control. Now, it's out of its misery.	John Hendrickson	2014-08-21T12:33:00Z	https://hips.hearstapps.com/esq.h-cdn.co/assets/cm/15/06/1600x800/54d430ebc95a4_-_letobeard-full.jpg?resize=480:*	
"It's 2014, And ""Neckbeard"" Is Now In The Dictionary"	https://www.esquire.com/style/grooming/a32846/neckbeard-dictionary/	Reminder: No one needs a neckbeard.	John Hendrickson	2014-08-15T15:40:00Z	https://hips.hearstapps.com/esq.h-cdn.co/assets/cm/15/07/640x320/54daf1f8adf62_-_shia-650.jpeg?resize=480:*	
Are James Franco and His New Blond Hair Going All Joaquin Phoenix on Us?	https://www.esquire.com/style/grooming/a29552/james-franco-blond-081114/	This could be the tipping point, gentlemen.	Andrew D. Luecke	2014-08-11T13:55:00Z	https://hips.hearstapps.com/esq.h-cdn.co/assets/cm/15/06/480x240/54d42cffdebef_-_esq-james-franco-goes-blond-081114-dtcxdu-xl.jpg?resize=480:*	
Obituary: Stan Rizzo's Beard is No More	https://www.esquire.com/style/grooming/a29469/stan-rizzo-beard-2014/	Mad Men's best facial hair has called it quits.	Max Berlinger	2014-07-30T12:42:00Z	https://hips.hearstapps.com/esq.h-cdn.co/assets/cm/15/06/768x384/54d429fce3b78_-_jpeg-xbh0s3.jpg?resize=480:*	
This Isn't Your Father's Dopp Kit	https://www.esquire.com/style/grooming/a29461/dopp-kit-mens-toiletry-bags/	Your toiletry bag says a lot about you, or at least it should.	Adam Hurly	2014-07-25T14:36:00Z	https://hips.hearstapps.com/hmg-prod.s3.amazonaws.com/images/lead-doppkit-1513632531.jpg?crop=1.00xw:1.00xh;0,0&resize=480:*	
Even Batman Doesn't Shave These Days	https://www.esquire.com/style/grooming/a29488/batman-poster-ben-affleck-2014/	The latest shot of the Caped Crusader proves that the beard battle has been won.	Max Berlinger	2014-07-25T10:37:00Z	https://hips.hearstapps.com/esq.h-cdn.co/assets/cm/15/06/54d4279150606_-_esq-batman-beard-2014-th2.jpg?crop=1xw:0.650000000000000xh;center,top&resize=480:*	
4 Manly Grooming Products That Won't Irritate Your Skin	https://www.esquire.com/style/grooming/g1775/4-grooming-products-that-wont-irritate-your-skin-0723/	A new line of grooming products for men takes inspiration from what women have known for years.	Calum Marsh	2014-07-23T16:38:00Z	https://hips.hearstapps.com/esq.h-cdn.co/assets/cm/15/06/54d3f0548f840_-_0-esq-pc4-072314-xl-0-53836133.jpg?crop=1xw:0.577160493827161xh;center,top&resize=480:*	
Your Hair Plans for the Fall, Courtesy of Game of Thrones	https://www.esquire.com/style/grooming/g1835/game-of-thrones-hair-071814/	The best show on TV has the best hair on TV. You can step up your fall grooming by taking notes.	Andrew D. Luecke	2014-07-18T11:58:00Z	https://hips.hearstapps.com/esq.h-cdn.co/assets/cm/15/07/480x240/54daeacc6b22c_-_esq-01-game-of-thrones-032912-mdn.jpg?resize=480:*	
Reasons to Shave Your Beard: Because Grandma Wants You To	https://www.esquire.com/style/grooming/a29309/beard-shave-2014/	One man gave his grandma a very special birthday gift.	Max Berlinger	2014-07-11T13:02:00Z	https://hips.hearstapps.com/esq.h-cdn.co/assets/cm/15/06/640x320/54d424099fea6_-_screenshot2014-07-11at11400pm.png?resize=480:*	
Today in Make Believe Trends: Beard Foliage	https://www.esquire.com/style/grooming/a29408/beard-garden-2014/	No, you shouldn't grow a facial hair garden.	Max Berlinger	2014-07-10T17:55:00Z	https://hips.hearstapps.com/esq.h-cdn.co/assets/cm/15/06/1600x800/54d423d6434ec_-_e6cd5141249088bb-72660013.jpg?resize=480:*	
Hugh Jackman's Hair: A Visual History	https://www.esquire.com/style/grooming/a29323/hugh-jackmans-hair-2014/	Everything from Fabio locks to a Captain Hook 'stache.	Sally Holmes	2014-07-09T10:30:00Z	https://hips.hearstapps.com/esq.h-cdn.co/assets/cm/15/07/640x320/54d94588adf9b_-_656_for_blog19-7nsjg5.jpg?resize=480:*	
See Tim Howard Without a Beard	https://www.esquire.com/style/grooming/a29276/tim-howard-sans-beard-070214/	America's greatest soccer hero was still a pro sans beard.	Andrew D. Luecke	2014-07-02T12:49:00Z	https://hips.hearstapps.com/esq.h-cdn.co/assets/cm/15/06/1280x640/54d421572f58c_-_esq-tim-howard-without-a-beard-070214-xxl.jpg?resize=480:*	
What Women Really Think of Your Beard	https://www.esquire.com/style/grooming/advice/a29174/what-women-think-of-your-beard-2014/	The editors of Elle.com weigh in on your facial hair.	Elle.com Editors	2014-06-27T13:05:00Z	https://hips.hearstapps.com/esq.h-cdn.co/assets/cm/15/06/480x240/54d4202d00733_-_esq-beard-debate-2014-73ihhm-xl.jpg?resize=480:*	
What's Up With Hugh Jackman's Half-Beard?	https://www.esquire.com/style/grooming/a29235/whats-up-with-hugh-jackmans-half-beard-062514/	The answer involves Vladimir Lenin, Peter Pan, and Burl Ives.	Andrew D. Luecke	2014-06-25T12:46:00Z	https://hips.hearstapps.com/esq.h-cdn.co/assets/cm/15/06/54d41f05cba05_-_esq-hugh-jackman-van-dyke-062514-th2.jpg?crop=1xw:0.650000000000000xh;center,top&resize=480:*	
Gray For a Day	https://www.esquire.com/style/grooming/a29275/gray-for-a-day-062414/	The good parts of accidentally going gray.	Ned Hepburn	2014-06-25T10:30:00Z	https://hips.hearstapps.com/esq.h-cdn.co/assets/cm/15/06/2560x1280/54d41f116210d_-_esq-gray-for-a-day-062514-xxl.jpg?resize=480:*	
Schick's Beard Barb Backfires	https://www.esquire.com/style/grooming/a29064/schicks-beard-barb-backfires-061814/	Did Schick's #FreeYourSkin ad campaign go too far?	Andrew D. Luecke	2014-06-18T13:24:00Z	https://hips.hearstapps.com/esq.h-cdn.co/assets/cm/15/06/4000x2000/54d41cf76d8b5_-_esq-beardos-bash-schick-061714-xxl.jpg?resize=480:*	
Behold! Jared Leto's Creepy Mustache	https://www.esquire.com/style/grooming/a29112/jared-leto-mustache-2014/	The actor revealed his newest grooming look on Instagram.	Max Berlinger	2014-06-17T19:00:00Z	https://hips.hearstapps.com/esq.h-cdn.co/assets/cm/15/06/54d41cceb07b8_-_esq-jared-leto-mustache-2014-th2.jpg?crop=1xw:0.650000000000000xh;center,top&resize=480:*	
Get to know Your Clay Pomade	https://www.esquire.com/style/grooming/a29087/clay-pomade-hair-2014/	. . . And paste, and cream, and even gel. A scientifical look at the stuff you've been putting in your hair.	Rodney Cutler	2014-06-13T09:15:00Z	https://hips.hearstapps.com/esq.h-cdn.co/assets/cm/15/06/480x240/54d41ae4a56e8_-_esq-hair-products-2014-xl.jpg?resize=480:*	
Is Your Beard Actually an Evil Squirrel?	https://www.esquire.com/style/grooming/a29147/schick-campaign-061114/	Pesky beards face eradication, says Schick.	Andrew D. Luecke	2014-06-12T15:05:00Z	https://hips.hearstapps.com/esq.h-cdn.co/assets/cm/15/06/1024x512/54d41a9c18ce8_-_esq-schick-beard-091214-xxl.jpg?resize=480:*	
Watch This Man Shave with Paper Cuts	https://www.esquire.com/style/grooming/videos/a28961/watch-this-man-shave-with-paper-cuts-06102014/	Thousands of tiny paper cuts.	Michael Howard	2014-06-10T16:32:00Z	https://hips.hearstapps.com/esq.h-cdn.co/assets/cm/15/06/768x384/54d419f52e353_-_nadeemhaidary_pcr_4color_905.jpg?resize=480:*	
Is This Guy the World's Most Inventive Barber?	https://www.esquire.com/style/grooming/a28951/worlds-most-inventive-barber/	Hair like you've never seen it.	Elizabeth Griffin	2014-06-05T18:16:00Z		
Peter Dinklage's Mullet: Who Wears It Best?	https://www.esquire.com/style/grooming/a29006/peter-dinklages-mullet-who-wears-it-best/	A hastily Photoshopped 80s hair adventure.	James Joiner	2014-06-04T13:35:00Z	https://hips.hearstapps.com/esq.h-cdn.co/assets/cm/15/06/480x240/54d4175a9c734_-_dinklageog.jpg?resize=480:*	
Esquire's Big Bad Beard Watch, Part I	https://www.esquire.com/style/grooming/a28986/esquires-big-bad-beard-watch-part-1-060314/	These beards are the worst.	Andrew D. Luecke	2014-06-03T14:42:00Z	https://hips.hearstapps.com/esq.h-cdn.co/assets/cm/15/06/2560x1280/54d4170930399_-_esq-bad-beards-060314-xxl.jpg?resize=480:*	
Chris Pine Wears A Beard For This Simple Reason	https://www.esquire.com/style/grooming/a28781/chris-pines-beard-053014/	Simple reasons are always the best.	Andrew D. Luecke	2014-05-30T12:31:00Z	https://hips.hearstapps.com/esq.h-cdn.co/assets/cm/15/06/2048x1024/54d415e19a870_-_esq-chris-pines-beard-053014-xxl.jpg?resize=480:*	
Disney Dudes Without Beards Says Facial Hair is Done	https://www.esquire.com/style/grooming/a28876/disney-dudes-without-beards-says-facial-hair-is-done-042814/	Disney Dudes Without Beards is apparently a thing now.	Andrew D. Luecke	2014-05-28T14:15:00Z	https://hips.hearstapps.com/esq.h-cdn.co/assets/cm/15/06/3200x1600/54d414449d73b_-_esq-disney-dudes-without-beards-052814-xxl.jpg?resize=480:*	
Did a 'Manzilian' Wax Get This Guy Arrested?	https://www.esquire.com/style/grooming/a28749/did-a-manzilian-wax-get-this-guy-arrested-052714/	More evidence that men should never wax.	Andrew D. Luecke	2014-05-27T16:03:00Z	https://hips.hearstapps.com/esq.h-cdn.co/assets/cm/15/06/4000x2000/54d4143588f9d_-_esq-manzilian-0527-xxl.jpg?resize=480:*	
The Great Beard Retreat of 2014, Exhibit A	https://www.esquire.com/style/grooming/a28774/mel-gibson-jake-gyllenhaal-beards-052114/	"Jake Gyllenhaal and Mel Gibson are real time case studies in ""peak beard"" story."	Andrew D. Luecke	2014-05-21T09:15:00Z	https://hips.hearstapps.com/esq.h-cdn.co/assets/cm/15/06/3200x1600/54d411fca45a4_-_esq-mel-gibson-jake-gyllenhaal-beards-052114-xxl.jpg?resize=480:*	
Lip Service: How to Protect Your Mouth This Summer	https://www.esquire.com/style/grooming/advice/a28619/dr-dewy-lip-balm-2014/	Dr. Dewy releases a line of skincare specifically made for your lips.	Max Berlinger	2014-05-15T11:08:00Z	https://hips.hearstapps.com/esq.h-cdn.co/assets/cm/15/06/480x240/54d4106a6899a_-_esq-dr-dewy-lip-balm-2014-lajnsr-xl.jpg?resize=480:*	
The 15 Fastest Ways to Piss Off Your Barber	https://www.esquire.com/style/grooming/a28818/barber-donts-2014/	We asked, they confessed.	Matthew Bell	2014-04-22T11:08:00Z	https://hips.hearstapps.com/esq.h-cdn.co/assets/15/16/3200x1600/landscape-1429077024-173720493.jpg?resize=480:*	
Blame Evolution for the Rise and Fall of the Beard	https://www.esquire.com/style/grooming/a28373/evolution-and-the-rise-and-fall-of-the-beard-041516/	Beard apogee signals trend reversal, reminds us grooming and style are in our DNA.	Andrew D. Luecke	2014-04-17T10:00:00Z	https://hips.hearstapps.com/esq.h-cdn.co/assets/cm/15/06/3200x1600/54d4080972441_-_lution-and-the-rise-and-fall-of-the-beard-041516-edjder-xxl.jpg?resize=480:*	
Everything You Wanted to Know About Your Cologne	https://www.esquire.com/style/grooming/advice/a28419/cologne-facts-2014/	How they're made, why they cost what they do, and how they make you smell nice.	Rodney Cutler	2014-04-16T15:37:00Z	https://hips.hearstapps.com/esq.h-cdn.co/assets/cm/15/06/480x240/54d40804c3f1d_-_esq-cologne-facts-2014-oxvvcp-xl.jpg?resize=480:*	
Why You Shouldn't Make Fun of Kim Jong-un's Haircut	https://www.esquire.com/style/grooming/a28249/north-korea-hair/	North Korean officials don't like it when you make fun of their Dear Leader.	Christian Araos	2014-04-15T13:29:00Z	https://hips.hearstapps.com/esq.h-cdn.co/assets/cm/15/06/54d406fc8961d_-_esq-01-kim-jong-de-thumb2.jpg?crop=1xw:0.650000000000000xh;center,top&resize=480:*	
Five Terms to Use With Your Barber	https://www.esquire.com/style/grooming/g1706/haircut-advice-2014/	You know how you want your hair to look, but you don't know how to explain it. Here are five terms your barber will understand.	The Fashion Editors	2014-04-11T10:28:00Z	https://hips.hearstapps.com/esq.h-cdn.co/assets/cm/15/17/480x240/landscape-54cd62ccea3dd-esq-styling-hair-at-barber-012413-l9nq0i-xlg.jpg?resize=480:*	
Behold: Jon Hamm's Glorious 90s Hair	https://www.esquire.com/style/grooming/a31215/jon-hamm-90s-hair-2014/	Even Don Draper didn't escape the decade unscathed.	Max Berlinger	2014-04-04T14:02:00Z	https://hips.hearstapps.com/esq.h-cdn.co/assets/cm/15/06/54d1d962e423f_-_79001_2635217514001_vs-521ed859e4b005116efbec44-86366013001.jpg?crop=1xw:0.888888888888889xh;center,top&resize=480:*	
